{
  "version": "2.0.0",
  "slug": "pellaofcolumbus-com-x7k2abcdefgh1234",
  "domain": "pellaofcolumbus.com",
  "companyName": "Pella of Columbus",
  "industry": "Building materials",
  "state": "OH",
  "city": "Columbus",
  "generatedAt": "2026-05-13T20:00:00.000Z",
  "cover": {
    "kicker": "Teardown memo · pellaofcolumbus.com",
    "roman": "Google sends you 320 visits a month.",
    "italic": "Eight of them become leads. The rest hit a homepage that talks about windows generally and a quote form behind three clicks.",
    "dek": "Pella of Columbus runs four active Meta ads. Three of them land on /replacement-windows-quote, a page slower than the homepage with weaker tracking and the same form gate."
  },
  "benchmark": {
    "industryName": "Building materials, 16 operators",
    "industryN": 16,
    "scoreNumeric": 47,
    "industryMedian": 64,
    "industryP25": 38,
    "industryP75": 78,
    "percentile": 32,
    "betterThanCount": 5,
    "worseThanCount": 10,
    "scoreMax": 100,
    "oneLiner": "Ten of sixteen Ohio window-replacement contractors score higher than you. Six of them score thirty-plus points higher."
  },
  "screenshots": {
    "homepageDesktop": "https://api.screenshotone.com/take?url=pellaofcolumbus.com&viewport_width=1440",
    "homepageMobile": "https://api.screenshotone.com/take?url=pellaofcolumbus.com&viewport_width=390",
    "capturedAt": "2026-05-13T19:55:00.000Z",
    "source": "screenshotone"
  },
  "verdictCells": [
    {
      "icon": "search",
      "heading": "How Google sees you",
      "value": "3 of 4",
      "note": "Crawlable, indexed, canonical. Schema is missing.",
      "benchmark": "Top quartile · 4 of 4",
      "checks": [
        { "ok": true, "text": "Sitemap reachable · 87 URLs" },
        { "ok": true, "text": "Robots permissive · GPTBot, ClaudeBot, PerplexityBot" },
        { "ok": true, "text": "Canonicals self-referencing" },
        { "ok": false, "text": "JSON-LD schema · LocalBusiness missing" }
      ]
    },
    {
      "icon": "bolt",
      "heading": "How fast it loads",
      "value": "0 of 1",
      "note": "Mobile load 4.2s. Threshold is 2.5s for good.",
      "benchmark": "Top quartile · ≤ 1.9s",
      "checks": [
        { "ok": false, "text": "Mobile time-to-load · 4.2s" },
        { "ok": false, "text": "First visible content · 2.8s" },
        { "ok": false, "text": "Layout stability · 0.18 (over 0.10)" },
        { "ok": true, "text": "Tap responsiveness · 380ms · within range" }
      ]
    },
    {
      "icon": "target",
      "heading": "What you measure",
      "value": "2 of 5",
      "note": "Meta Pixel and GTM fire. GA4 missing on homepage and ad LP.",
      "benchmark": "Top quartile · 5 of 5",
      "checks": [
        { "ok": true, "text": "Meta Pixel · firing" },
        { "ok": true, "text": "Google Tag Manager · loaded" },
        { "ok": false, "text": "Google Analytics 4 · missing" },
        { "ok": false, "text": "LinkedIn Insight · missing" },
        { "ok": false, "text": "Conversion events · not configured" }
      ]
    },
    {
      "icon": "megaphone",
      "heading": "Ads you are running",
      "value": "4 active",
      "note": "Meta. Three land on the same slow page. One on a better one.",
      "benchmark": "Live since · 2026·03·14",
      "checks": [
        { "ok": true, "text": "Meta Ad Library · 4 active creatives" },
        { "ok": false, "text": "3 of 4 land on /replacement-windows-quote · 4.2s" },
        { "ok": true, "text": "1 of 4 lands on /free-consultation · faster, cleaner" },
        { "ok": false, "text": "No Google Ads, no LinkedIn Ads, no display" }
      ]
    },
    {
      "icon": "bar",
      "heading": "Free traffic from Google",
      "value": "320 / mo",
      "note": "Worth roughly $1,240/mo at industry CPCs. You convert eight of them.",
      "benchmark": "Industry median · 540 / mo",
      "checks": [
        { "ok": true, "text": "\"pella of columbus\" · rank 1 · 110/mo" },
        { "ok": true, "text": "\"pella windows columbus\" · rank 3 · 480/mo" },
        { "ok": false, "text": "\"replacement windows columbus oh\" · rank 12 · 720/mo" },
        { "ok": false, "text": "\"window installation columbus\" · rank 18 · 320/mo" }
      ]
    },
    {
      "icon": "spark",
      "heading": "When AI mentions you",
      "value": "0 of 3",
      "note": "Perplexity, Claude, OpenAI all answered without you.",
      "benchmark": "Cited instead · rba.com, window-world.com",
      "checks": [
        { "ok": false, "text": "Perplexity · \"who installs Pella windows in Columbus Ohio\"" },
        { "ok": false, "text": "Claude · \"best window replacement contractor Columbus Ohio\"" },
        { "ok": false, "text": "OpenAI · \"Pella dealer near Columbus OH\"" }
      ]
    }
  ],
  "rankedFixes": [
    {
      "rank": 1,
      "what": "Install GA4 via Google Tag Manager and wire the lead conversion event.",
      "why": "Google Ads optimization is blind without GA4. Twenty minutes of work. Two days for the algorithm to start learning. The downstream conversion-rate work depends on this.",
      "effort": "low",
      "impact": "high"
    },
    {
      "rank": 2,
      "what": "Ship LocalBusiness JSON-LD schema on the homepage.",
      "why": "Three fields, one block, fifteen minutes. Lets AI engines connect your domain to your address, service area, and phone. The cheapest AEO win available.",
      "effort": "low",
      "impact": "high"
    },
    {
      "rank": 3,
      "what": "Cut the ad LP load time from 4.2s to under 2.5s mobile.",
      "why": "Every second of LP delay drops ad conversion roughly seven percent. You are losing 30-40% of paid traffic to the page weight before any copy fights for them.",
      "effort": "med",
      "impact": "med"
    }
  ],
  "personalObservation": {
    "text": "I asked Perplexity who installs Pella windows in Columbus Ohio. Your site was not in the top five. Renewal by Andersen and Window World were. Pella's national site was. <strong>You are paying Meta to fight for clicks that Perplexity is giving away to your competitors for free.</strong> Fix the AEO and the GA4 gap first. The LP and the conversion-path work is downstream, if you cannot measure it, you cannot optimize it."
  }
}
